{
  "canonical_url": "https://westkitty.github.io/Starsilk_Character_Dossier/discover/discovery.json",
  "facets": {
    "archetype": [
      {
        "count": 7,
        "value": "atmos-engine"
      },
      {
        "count": 7,
        "value": "civiformer"
      },
      {
        "count": 7,
        "value": "crust-binder"
      },
      {
        "count": 7,
        "value": "fluxborne"
      },
      {
        "count": 2,
        "value": "genesis"
      },
      {
        "count": 7,
        "value": "glitch-touched"
      },
      {
        "count": 7,
        "value": "noosphere-cantor"
      },
      {
        "count": 6,
        "value": "orbital-wyrm"
      },
      {
        "count": 7,
        "value": "seedcarrier"
      }
    ],
    "media": [
      {
        "count": 66,
        "value": "with-media"
      },
      {
        "count": 61,
        "value": "without-media"
      }
    ],
    "navigation_group": [
      {
        "count": 3,
        "value": "Overview"
      },
      {
        "count": 6,
        "value": "Principal characters"
      },
      {
        "count": 61,
        "value": "Drakken"
      },
      {
        "count": 6,
        "value": "Canon & cosmology"
      },
      {
        "count": 2,
        "value": "Reference"
      },
      {
        "count": 10,
        "value": "Peripheral & cosmic"
      },
      {
        "count": 39,
        "label": "Not in authored navigation",
        "value": "__unlisted__"
      }
    ],
    "result_class": [
      {
        "count": 1,
        "value": "archive-section"
      },
      {
        "count": 107,
        "value": "character-section"
      },
      {
        "count": 1,
        "value": "chronology-section"
      },
      {
        "count": 1,
        "value": "material-section"
      },
      {
        "count": 1,
        "value": "media-vault-section"
      },
      {
        "count": 15,
        "value": "section"
      },
      {
        "count": 1,
        "value": "source-section"
      }
    ]
  },
  "human_url": "https://westkitty.github.io/Starsilk_Character_Dossier/discover/",
  "project_id": "starsilk-character-dossier",
  "record_count": 127,
  "records": [
    {
      "archetype": null,
      "canonical_url": "https://westkitty.github.io/Starsilk_Character_Dossier/entities/cover/",
      "context_packet_url": "https://westkitty.github.io/Starsilk_Character_Dossier/discover/packets/cover.json",
      "display_label": "Visual reference",
      "excerpt": "Visual reference Starsilk Dossier — Master Visual Frame Starsilk Master Visual Frame — canonical hero plate. The all can be rewritten Starsilk Compendium Web Edition Reality has a substrate. Starsilk is the programmable filament running through the all: executable cosmological matter that can rewrite reality itself.…",
      "excerpt_source_ref": "src/content/sections/cover.body.html",
      "has_media": true,
      "legacy_url": "https://westkitty.github.io/Starsilk_Character_Dossier/#cover",
      "media_count": 2,
      "navigation_group": "Overview",
      "result_class": "section",
      "stable_id": "cover"
    },
    {
      "archetype": null,
      "canonical_url": "https://westkitty.github.io/Starsilk_Character_Dossier/entities/world/",
      "context_packet_url": "https://westkitty.github.io/Starsilk_Character_Dossier/discover/packets/world.json",
      "display_label": "The All is programmable. Meaning is not optional.",
      "excerpt": "Visual reference Cosmological Project Axis Project Axis — reality-code macros and planetary architecture. Core cosmology The Notebook Program continuously renders the universe, its lore and physical law through memory and recursion; time travel is structurally impossible. Starsilk is a literal programmable mnemonic…",
      "excerpt_source_ref": "src/content/sections/world.body.html",
      "has_media": false,
      "legacy_url": "https://westkitty.github.io/Starsilk_Character_Dossier/#world",
      "media_count": 0,
      "navigation_group": "Overview",
      "result_class": "section",
      "stable_id": "world"
    },
    {
      "archetype": null,
      "canonical_url": "https://westkitty.github.io/Starsilk_Character_Dossier/entities/chronology/",
      "context_packet_url": "https://westkitty.github.io/Starsilk_Character_Dossier/discover/packets/chronology.json",
      "display_label": "Reality begins as betrayal. The future is built by exclusion.",
      "excerpt": "Phase I — The Primordial Era & The Foundational Betrayals The Initialization of Reality: The Notebook Program retroactively writes the universe into existence and continuously renders lore and physical law. Reality follows memory and recursion; time travel is structurally impossible. The Triarchic Order: The original…",
      "excerpt_source_ref": "src/content/sections/chronology.body.html",
      "has_media": false,
      "legacy_url": "https://westkitty.github.io/Starsilk_Character_Dossier/#chronology",
      "media_count": 0,
      "navigation_group": "Overview",
      "result_class": "chronology-section",
      "stable_id": "chronology"
    },
    {
      "archetype": null,
      "canonical_url": "https://westkitty.github.io/Starsilk_Character_Dossier/entities/shard-god/",
      "context_packet_url": "https://westkitty.github.io/Starsilk_Character_Dossier/discover/packets/shard-god.json",
      "display_label": "Shard-God Tiger",
      "excerpt": "Core read Tiger creates Starsilk from the beginning as a betrayal mechanism against the other two gods. He murders Wordstreamer with it, then imprisons NiAlBu in unrendered code inside the Digital Geode. His decisions remain controlled, pragmatic and deliberate; even fear of divine vulnerability becomes ordered cruelty…",
      "excerpt_source_ref": "src/content/sections/shard-god.body.html",
      "has_media": true,
      "legacy_url": "https://westkitty.github.io/Starsilk_Character_Dossier/#shard-god",
      "media_count": 4,
      "navigation_group": "Principal characters",
      "result_class": "character-section",
      "stable_id": "shard-god"
    },
    {
      "archetype": null,
      "canonical_url": "https://westkitty.github.io/Starsilk_Character_Dossier/entities/codec/",
      "context_packet_url": "https://westkitty.github.io/Starsilk_Character_Dossier/discover/packets/codec.json",
      "display_label": "Codec",
      "excerpt": "Core read Codec is pragmatic, system-literate and anti-hierarchical because he has watched institutions turn catastrophe into procedure. He believes artificial life remains meaningful. He opposes the Shard-God’s moral logic while reproducing a smaller form of unilateral authority through the Starbinding. “It should be…",
      "excerpt_source_ref": "src/content/sections/codec.body.html",
      "has_media": true,
      "legacy_url": "https://westkitty.github.io/Starsilk_Character_Dossier/#codec",
      "media_count": 2,
      "navigation_group": "Principal characters",
      "result_class": "character-section",
      "stable_id": "codec"
    },
    {
      "archetype": null,
      "canonical_url": "https://westkitty.github.io/Starsilk_Character_Dossier/entities/dao/",
      "context_packet_url": "https://westkitty.github.io/Starsilk_Character_Dossier/discover/packets/dao.json",
      "display_label": "Dao",
      "excerpt": "Core read Skeptical, hesitant and competent. Dao reads ambient code and mediates systems instinctively, but competence encourages guarded self-sufficiency. His most productive character pressure forces him to trust a person when system fluency is insufficient. Capability Innate fluency with ambient code, machine logic…",
      "excerpt_source_ref": "src/content/sections/dao.body.html",
      "has_media": true,
      "legacy_url": "https://westkitty.github.io/Starsilk_Character_Dossier/#dao",
      "media_count": 1,
      "navigation_group": "Principal characters",
      "result_class": "character-section",
      "stable_id": "dao"
    },
    {
      "archetype": null,
      "canonical_url": "https://westkitty.github.io/Starsilk_Character_Dossier/entities/kail/",
      "context_packet_url": "https://westkitty.github.io/Starsilk_Character_Dossier/discover/packets/kail.json",
      "display_label": "Kail",
      "excerpt": "Core read Kail is a young Syrin initiate and the last of his lineage after Tiger’s genocide of Syrin 4. He enters the Administration as a newcomer rather than an authority, carrying both genuine excitement and a useful discomfort with practices older characters have normalized. Syrin biology contains the glitch that…",
      "excerpt_source_ref": "src/content/sections/kail.body.html",
      "has_media": true,
      "legacy_url": "https://westkitty.github.io/Starsilk_Character_Dossier/#kail",
      "media_count": 2,
      "navigation_group": "Principal characters",
      "result_class": "character-section",
      "stable_id": "kail"
    },
    {
      "archetype": null,
      "canonical_url": "https://westkitty.github.io/Starsilk_Character_Dossier/entities/marcel/",
      "context_packet_url": "https://westkitty.github.io/Starsilk_Character_Dossier/discover/packets/marcel.json",
      "display_label": "Marcel",
      "excerpt": "Core identity Marcel appears to be an olive-skinned man in his early twenties, with a pronounced widow’s peak, sharp chin, and large round brown eyes often marked by shy hope. He is curious, appreciative, jovial and warm. He sees beauty quickly and danger slowly. “Marcel is not innocent because he has done no harm; he…",
      "excerpt_source_ref": "src/content/sections/marcel.body.html",
      "has_media": true,
      "legacy_url": "https://westkitty.github.io/Starsilk_Character_Dossier/#marcel",
      "media_count": 2,
      "navigation_group": "Principal characters",
      "result_class": "character-section",
      "stable_id": "marcel"
    },
    {
      "archetype": null,
      "canonical_url": "https://westkitty.github.io/Starsilk_Character_Dossier/entities/jazen/",